Nombre,Descripción,Tipo de lugar,Dirección,Municipio,Provincia,Postal Code,Marcas,Email,Teléfono,WEB,URL amigable,Visita Guiada,Capacidad,Tienda,Tipo de Cultura,Coordenadas GPS,LATWGS84,LONWGS84
Palacio de John (Edificio La Bolsa),"El Palacio de John, también conocido como el edificio de La Bolsa, está situado en ...",Patrimonio cultural,Pelota 10,Bilbao,Bizkaia,48005.0,Bilbao,cmdcascoviejo@bilbao.eus,944 163 188,,https://turismoa.euskadi.eus/es/patrimonio-cultural/palacio-de-john-edificio-la-bolsa/webtur00-content/es/,0.0,0.0,0.0,Patrimonio Cultural,"43.25758411555616,-2.925099462530849",43.25758411555616,-2.925099462530849
Palacio Colina,El palacio de La Colina es una construcción del siglo XVIII. Este edificio barroco tiene u...,Patrimonio cultural,"Calle Real, 13",Lanestosa,Bizkaia,48895.0,Montes y Valles vascos,info@enkartur.eus,946 802 976,,https://turismoa.euskadi.eus/es/patrimonio-cultural/palacio-colina/webtur00-content/es/,0.0,0.0,0.0,Patrimonio Cultural,"43.217806227686125,-3.4381379020995806",43.217806227686125,-3.4381379020995806
Las casas de la Plaza Vieja,"Son casas conocidas como casas de labranza, donde antiguamente vivían los labradores. Tien...",Patrimonio cultural,Plaza Vieja,Lanestosa,Bizkaia,48895.0,Montes y Valles vascos,info@visitenkarterri.com,675 716 161,,https://turismoa.euskadi.eus/es/patrimonio-cultural/las-casas-de-la-plaza-vieja/webtur00-content/es/,0.0,0.0,0.0,Patrimonio Cultural,"43.219500963672765,-3.4400081634521484",43.219500963672765,-3.4400081634521484
Monumento a Elkano,"Este monumento fue realizado en memoria de Juan Sebastián Elkano, uno de los personaj...",Patrimonio cultural,Carretera N-634 hacia Zarautz,Getaria,Gipuzkoa,20808.0,Costa Vasca,infoturismo@getaria.eus,943 140 957,,https://turismoa.euskadi.eus/es/patrimonio-cultural/monumento-a-elcano/webtur00-content/es/,0.0,0.0,0.0,Patrimonio Cultural,"43.30275242881342,-2.2036229808815055",43.30275242881342,-2.203622980881505
Antigua iglesia de Biañez,"La iglesia vieja de Biañez, convertida hoy por hoy en museo, fue construida entre los sigl...",Patrimonio cultural,Barrio de Biañez,Karrantza Harana/Valle de Carranza,Bizkaia,48891.0,Montes y Valles vascos,turismokarrantza@gmail.com,946 806 928,https://www.visitenkarterri.com/ver-hacer/museos/pinturas-de-san-andres-de-bianez.html,https://turismoa.euskadi.eus/es/patrimonio-cultural/antigua-iglesia-de-bianez/webtur00-content/es/,1.0,0.0,0.0,Patrimonio Cultural,"43.24104177934025,-3.346531646066888",43.24104177934025,-3.346531646066888
Puente de la Zurriola,Es el primero de los cuatro puentes que se sitúan en la desembocadura del río Urume...,Patrimonio cultural,Paseo de la Zurriola,Donostia / San Sebastián,Gipuzkoa,20003.0,"Costa Vasca,San Sebastián",sansebastianturismoa@donostia.eus,943 481 166,,https://turismoa.euskadi.eus/es/patrimonio-cultural/puente-de-la-zurriola/webtur00-content/es/,0.0,0.0,0.0,Patrimonio Cultural,"43.323537323438536,-1.9799058465576191",43.323537323438536,-1.9799058465576191
Itinerario megalítico de Haizko,La sierra de Ubal es rica en monumentos megalíticos. Los antiguos moradores del Valle de K...,Patrimonio cultural,Sierra de Ubal,Karrantza Harana/Valle de Carranza,Bizkaia,48891.0,Montes y Valles vascos,turismo@karrantza.org,946 806 928,,https://turismoa.euskadi.eus/es/patrimonio-cultural/itinerario-megalitico-de-haizko/webtur00-content/es/,0.0,0.0,0.0,Patrimonio Cultural,"43.18935248384895,-3.408740568627986",43.18935248384895,-3.408740568627986
Chalet Hernáiz,"Los hermanos Hernáiz mandaron construir el chalet en 1904, cuando volvieron de Puerto Rico...",Patrimonio cultural,"Barrio de Concha, 71",Karrantza Harana/Valle de Carranza,Bizkaia,48891.0,Montes y Valles vascos,turismo@karrantza.org,946 806 928,,https://turismoa.euskadi.eus/es/patrimonio-cultural/chalet-hernaiz/webtur00-content/es/,0.0,0.0,0.0,Patrimonio Cultural,"43.22539909330385,-3.360230429360962",43.22539909330385,-3.360230429360962
Parque de Sagastigutia,"El parque Sagastigutia se halla en el casco urbano del municipio de Beasain, a escasos metros de ...",Patrimonio cultural,Sagastigutia,Beasain,Gipuzkoa,20200.0,Montes y Valles vascos,udala@beasain.eus,943 02 80 50,,https://turismoa.euskadi.eus/es/patrimonio-cultural/parque-de-sagastigutia/webtur00-content/es/,0.0,0.0,0.0,Patrimonio Cultural,"43.04856625593852,-2.1931933762741718",43.04856625593852,-2.193193376274172
Palacio de Arana,"El majestuoso palacio de Arana, edificado por Don Juan Ramón Arana en 1852, se encuentra e...",Patrimonio cultural,"Barrio Elizalde, 23",Izurtza,Bizkaia,48213.0,Montes y Valles vascos,turismo@durango.eus,946 813 548,,https://turismoa.euskadi.eus/es/patrimonio-cultural/palacio-de-arana/webtur00-content/es/,0.0,0.0,0.0,Patrimonio Cultural,"43.15358145510195,-2.64034941716613",43.15358145510195,-2.64034941716613
Chalet Portillo,"El dueño del chalet Portillo era el indiano Luis Portillo, que hizo fortuna en Cuba y a su...",Patrimonio cultural,"La Tejera, 1",Karrantza Harana/Valle de Carranza,Bizkaia,48891.0,Montes y Valles vascos,turismo@karrantza.org,946 806 928,,https://turismoa.euskadi.eus/es/patrimonio-cultural/chalet-portillo/webtur00-content/es/,0.0,0.0,0.0,Patrimonio Cultural,"43.220673435028075,-3.3561519296387132",43.22067343502808,-3.356151929638713
Torre de Etxaburu,"En la carretera entre Durango-Urkiola, dentro del municipio de Izurtza, se alza la torre de Etxab...",Patrimonio cultural,Barrio Ortuzar,Izurtza,Bizkaia,48213.0,Montes y Valles vascos,turismo@durango.eus,946 813 548,,https://turismoa.euskadi.eus/es/patrimonio-cultural/torre-de-etxaburu/webtur00-content/es/,0.0,0.0,0.0,Patrimonio Cultural,"43.145544664182715,-2.6537920814016625",43.14554466418272,-2.6537920814016625
Iglesia de San Martín (Getaria),La iglesia de San Martin es la parroquia del barrio de Askizu en Getaria.Además de ser una...,Patrimonio cultural,Barrio Askizu,Getaria,Gipuzkoa,20808.0,Costa Vasca,,,,https://turismoa.euskadi.eus/es/patrimonio-cultural/iglesia-de-san-martin-getaria/webtur00-content/es/,0.0,0.0,0.0,Patrimonio Cultural,"43.30310643735227,-2.2297483907378757",43.30310643735227,-2.229748390737876
Figuras grabadas de la cueva de Venta Laperra,La cueva de Venta Laperra está en la ladera del monte Ranero. Durante el Paleolític...,Patrimonio cultural,Barrio La Cadena,Karrantza Harana/Valle de Carranza,Bizkaia,48891.0,Montes y Valles vascos,turismo@karrantza.org,946 806 928,,https://turismoa.euskadi.eus/es/patrimonio-cultural/figuras-grabadas-de-la-cueva-de-venta-laperra/webtur00-content/es/,0.0,0.0,0.0,Patrimonio Cultural,"43.25280643217795,-3.391114257824711",43.25280643217795,-3.391114257824711
Iglesia de San Miguel Arcángel (Oñati),La iglesia de San Miguel de Oñati es el ejemplo perfecto de un templo que se ha ido constr...,Patrimonio cultural,"Avenida de Unibertsitate, 2",Oñati,Gipuzkoa,20560.0,Montes y Valles vascos,turismo@onati.eus,943 783 453,,https://turismoa.euskadi.eus/es/patrimonio-cultural/iglesia-de-san-miguel-onati/webtur00-content/es/,1.0,0.0,0.0,Patrimonio Cultural,"43.03309030614297,-2.4139726852500853",43.03309030614297,-2.4139726852500853
Ermita de San Pedro de Elorriaga,"La ermita de San Pedro de Elorriaga, ubicada en el municipio de Lemoa, se reedificó en el ...",Patrimonio cultural,"Barrio Elorriaga, 15H",Lemoa,Bizkaia,48330.0,Montes y Valles vascos,harrera@lemoa.net,946 313 005,,https://turismoa.euskadi.eus/es/patrimonio-cultural/ermita-de-san-pedro-de-elorriaga/webtur00-content/es/,0.0,0.0,0.0,Patrimonio Cultural,"43.19869670125711,-2.7592536441802684",43.19869670125711,-2.7592536441802684
Monasterio de Bidaurreta,"Juan López de Lazarraga, contador de los Reyes Católicos, y su esposa Juana de Gamb...",Patrimonio cultural,"Lazarraga kalea, 12",Oñati,Gipuzkoa,20560.0,Montes y Valles vascos,turismo@onati.eus,943 783 453,,https://turismoa.euskadi.eus/es/patrimonio-cultural/monasterio-de-bidaurreta/webtur00-content/es/,1.0,0.0,0.0,Patrimonio Cultural,"43.031334139357234,-2.406990973016377",43.031334139357234,-2.406990973016377
Iglesia de San Bartolomé de Aldeacueva,La iglesia de San Bartolomé de Aldeacueva es un edificio de grandes dimensiones construido...,Patrimonio cultural,Barrio de Aldeacueva,Karrantza Harana/Valle de Carranza,Bizkaia,48891.0,Montes y Valles vascos,turismokarrantza@gmail.com,946 806 928,,https://turismoa.euskadi.eus/es/patrimonio-cultural/iglesia-de-san-bartolome-de-aldeacueva/webtur00-content/es/,0.0,0.0,0.0,Patrimonio Cultural,"43.194548434611455,-3.3805180904696464",43.194548434611455,-3.3805180904696464
Plaza de los Fueros,"Tras la incorporación de Oñati a la provincia de Gipuzkoa, surgió un plan pa...",Patrimonio cultural,,Oñati,Gipuzkoa,20560.0,Montes y Valles vascos,turismo@onati.eus,943 783 453,,https://turismoa.euskadi.eus/es/patrimonio-cultural/plaza-de-los-fueros/webtur00-content/es/,1.0,0.0,0.0,Patrimonio Cultural,"43.032830020294654,-2.4135747399504908",43.032830020294654,-2.4135747399504908
Palacio Miramar,"Cuando la reina regente María Cristina, madre de Alfonso XIII, comenzó a veranear e...",Patrimonio cultural,Parque Miramar,Donostia / San Sebastián,Gipuzkoa,20009.0,"Costa Vasca,San Sebastián",sansebastianturismoa@donostia.eus,943 481 166,,https://turismoa.euskadi.eus/es/patrimonio-cultural/palacio-miramar/webtur00-content/es/,0.0,0.0,0.0,Patrimonio Cultural,"43.315016006935195,-1.9988923863525332",43.3150160069352,-1.9988923863525327
Estación megalítica de Aizkorri,La estación megalítica de Aizkorri se encuentra dividida entre las tierras de O&nti...,Patrimonio cultural,Campas de Urbia,Oñati,Gipuzkoa,20560.0,Montes y Valles vascos,turismo@onati.eus,943 783 453,,https://turismoa.euskadi.eus/es/patrimonio-cultural/estacion-megalitica-de-aizkorri/webtur00-content/es/,0.0,0.0,0.0,Patrimonio Cultural,"42.963193607887256,-2.357616494195547",42.963193607887256,-2.357616494195547
Monumento-Homenaje al Pastor Vasco,El Monumento-Homenaje al Pastor Vasco es una obra de arte del escultor Nestor Basterretxea (Berme...,Patrimonio cultural,Uribarri Auzoa,Oñati,Gipuzkoa,20560.0,Montes y Valles vascos,,943 783 453,,https://turismoa.euskadi.eus/es/patrimonio-cultural/monumento-homenaje-al-pastor-vasco/webtur00-content/es/,0.0,0.0,0.0,Patrimonio Cultural,"43.023182843826945,-2.413119423989878",43.02318284382695,-2.413119423989878
Torre Garibai,"La torre Garibai, a la que numerosos documentos del siglo XIV hacen referencia, está situa...",Patrimonio cultural,Barrio Torreauzo,Oñati,Gipuzkoa,20560.0,Montes y Valles vascos,turismo@onati.eus,943 783 453,,https://turismoa.euskadi.eus/es/patrimonio-cultural/torre-garibai/webtur00-content/es/,0.0,0.0,0.0,Patrimonio Cultural,"43.0446723117353,-2.426983968147587",43.0446723117353,-2.426983968147587
Torre de Olakua,"La casa torre de Olakua, situada a 200 metros del Monasterio de Bidaurreta, se construyó e...",Patrimonio cultural,Barrio Olakua,Oñati,Gipuzkoa,20560.0,Montes y Valles vascos,turismo@onati.eus,943 783 453,,https://turismoa.euskadi.eus/es/patrimonio-cultural/torre-de-olakua/webtur00-content/es/,1.0,0.0,0.0,Patrimonio Cultural,"43.03139098563684,-2.404211142258459",43.03139098563684,-2.404211142258459
Puente de Santa Catalina,El Puente de Santa Catalina es el segundo de los cuatro puentes que cruza el río Urumea en...,Patrimonio cultural,Entre el Paseo de Francia y el Paseo de los Fueros,Donostia / San Sebastián,Gipuzkoa,20012.0,"Costa Vasca,San Sebastián",sansebastianturismoa@donostia.eus,943 481 166,,https://turismoa.euskadi.eus/es/patrimonio-cultural/puente-de-santa-catalina/webtur00-content/es/,0.0,0.0,0.0,Patrimonio Cultural,"43.320988054637695,-1.9782217962951587",43.320988054637695,-1.9782217962951587
Iglesia de San Miguel de Ahedo,"La Iglesia de San Miguel de Ahedo data del siglo XVII, cuando se edificó sobre los restos ...",Patrimonio cultural,Barrio de Ahedo,Karrantza Harana/Valle de Carranza,Bizkaia,48891.0,Montes y Valles vascos,turismokarrantza@gmail.com,946 806 928,,https://turismoa.euskadi.eus/es/patrimonio-cultural/iglesia-de-san-miguel-de-ahedo/webtur00-content/es/,0.0,0.0,0.0,Patrimonio Cultural,"43.2277100906306,-3.3557518613769144",43.2277100906306,-3.3557518613769144
Iglesia de Santa Cecilia. Santecilla,"La iglesia de Santa Cecilia fue construida entre los siglos XVII y XVIII, y es de estilo barroco ...",Patrimonio cultural,Barrio de Santecilla,Karrantza Harana/Valle de Carranza,Bizkaia,48891.0,Montes y Valles vascos,turismo@karrantza.org,946 806 928,,https://turismoa.euskadi.eus/es/patrimonio-cultural/iglesia-de-santa-cecilia-santecilla/webtur00-content/es/,1.0,0.0,0.0,Patrimonio Cultural,"43.25883469057331,-3.3579264456466285",43.25883469057331,-3.3579264456466285
Iglesia de Santo Tomás de Olabarrieta,"Situada en un robledal de Zeberio, la iglesia de Santo Tomás de Olabarrieta constituye uno...",Patrimonio cultural,"Barrio Elizondo, s/n",Zeberio,Bizkaia,48499.0,Montes y Valles vascos,udala.zeberio@bizkaia.org,946 481 079,,https://turismoa.euskadi.eus/es/patrimonio-cultural/iglesia-de-santo-tomas-de-olabarrieta/webtur00-content/es/,0.0,0.0,0.0,Patrimonio Cultural,"43.14510708248784,-2.834730745446794",43.14510708248784,-2.834730745446794
Casa Portalondo o Torre de los Gentiles,La Casa Portalondo o Torre de los Gentiles es una edificación de planta rectangular y cubi...,Patrimonio cultural,"Calle Kardaberaz, 46",Hernani,Gipuzkoa,20120.0,"Montes y Valles vascos,San Sebastián",artxiboa@hernani.eus,943 337 030,,https://turismoa.euskadi.eus/es/patrimonio-cultural/casa-portalondo-o-torre-de-los-gentiles/webtur00-content/es/,0.0,0.0,0.0,Patrimonio Cultural,"43.26626350408674,-1.9740146050712548",43.26626350408674,-1.9740146050712548
Iglesia de San Juan Bautista (Hernani),"La iglesia de San Juan Bautista está emplazada en pleno centro de Hernani, en la plaza Gud...",Patrimonio cultural,"Gudarien plaza, 2",Hernani,Gipuzkoa,20120.0,"Montes y Valles vascos,San Sebastián",,943 552 684,,https://turismoa.euskadi.eus/es/patrimonio-cultural/iglesia-de-san-juan-bautista-hernani/webtur00-content/es/,0.0,0.0,0.0,Patrimonio Cultural,"43.26564294183247,-1.9761016441109436",43.26564294183247,-1.976101644110944
Ermita Nuestra Señora de Zeberiogana,La ermita Nuestra Señora de Zeberiogana es una de los elementos arquitectónicos de ...,Patrimonio cultural,Barrio Zeberiogana,Zeberio,Bizkaia,48499.0,Montes y Valles vascos,udala.zeberio@bizkaia.org,946 481 079,,https://turismoa.euskadi.eus/es/patrimonio-cultural/ermita-nuestra-senora-de-zeberiogana/webtur00-content/es/,0.0,0.0,0.0,Patrimonio Cultural,"43.15751311689877,-2.8387667460327126",43.15751311689877,-2.8387667460327126
Estación megalítica de Oiartzun,"Ubicada en el Parque Natural de Aiako Harria, la estación megalítica de Oiartzun co...",Patrimonio cultural,Parque Natural de Aiako Harria,Oiartzun,Gipuzkoa,20180.0,Montes y Valles vascos,turismoa@oarsoaldea.eus,943 494 521,http://www.oarsoaldeaturismoa.eus,https://turismoa.euskadi.eus/es/patrimonio-cultural/estacion-megalitica-de-oiartzun/webtur00-content/es/,0.0,0.0,0.0,Patrimonio Cultural,"43.25338565900122,-1.8271714477905432",43.25338565900122,-1.8271714477905432
Palacio Amézaga,El municipio de Mallabia cuenta con uno de los palacios rurales más emblemáticos de...,Patrimonio cultural,"Azkaldea, 5",Mallabia,Bizkaia,48269.0,Montes y Valles vascos,mallabiaudala@euskalnet.net,943 171 461,,https://turismoa.euskadi.eus/es/patrimonio-cultural/palacio-amezaga/webtur00-content/es/,0.0,0.0,0.0,Patrimonio Cultural,"43.18968441239711,-2.5314070558197255",43.18968441239711,-2.531407055819725
Calero de San Justo,El calero de San Justo se ubica en un robledal junto a la ermita de Justo y Pastor. De estructura...,Patrimonio cultural,Barrio Ozerimendi,Zeanuri,Bizkaia,48144.0,Montes y Valles vascos,ambengoetxea@zeanuri.eus,946 739 146,,https://turismoa.euskadi.eus/es/patrimonio-cultural/calero-de-san-justo/webtur00-content/es/,0.0,0.0,0.0,Patrimonio Cultural,"43.08574296239623,-2.7651624009551923",43.08574296239623,-2.7651624009551923
Iglesia de San Francisco,"La iglesia de San Francisco está situada en el centro de Tolosa, adosada al convento de lo...",Patrimonio cultural,Calle San Francisco,Tolosa,Gipuzkoa,20400.0,Montes y Valles vascos,tour@tolosaldea.eus,943 697 413,,https://turismoa.euskadi.eus/es/patrimonio-cultural/iglesia-de-san-francisco/webtur00-content/es/,0.0,0.0,0.0,Patrimonio Cultural,"43.13673444021709,-2.0743860190491437",43.13673444021709,-2.074386019049144
Plaza de Santa Marina,La Plaza de Santa Marina fue construida entre los siglos XVIII y XIX como resultado del esp&iacut...,Patrimonio cultural,,Oñati,Gipuzkoa,20560.0,Montes y Valles vascos,turismo@onati.eus,943 783 453,,https://turismoa.euskadi.eus/es/patrimonio-cultural/plaza-de-santa-marina/webtur00-content/es/,1.0,0.0,0.0,Patrimonio Cultural,"43.03282656307309,-2.4108143290527506",43.03282656307309,-2.4108143290527506
Universidad Sancti Spiritus,El obispo Rodrigo Mercado de Zuazola estaba convencido de que la gente de las tierras vascas ten&...,Patrimonio cultural,"Avenida de la Universidad, 8<br/>",Oñati,Gipuzkoa,20560.0,Montes y Valles vascos,turismo@onati.eus,943 783 453,https://www.oñatiturismo.eus/es/,https://turismoa.euskadi.eus/es/patrimonio-cultural/universidad-sancti-spiritus/webtur00-content/es/,1.0,0.0,0.0,Patrimonio Cultural,"43.0339443326967,-2.4153947788361165",43.0339443326967,-2.4153947788361165
Iglesia de Santa María de la Asunción (Mañaria),El municipio de Mañaria cuenta con una de las iglesias más destacables y valiosas d...,Patrimonio cultural,"Andra Mari, 3",Mañaria,Bizkaia,48212.0,Montes y Valles vascos,kultura.manaria@bizkaia.org,946 818 998,,https://turismoa.euskadi.eus/es/patrimonio-cultural/iglesia-de-santa-maria-de-la-asuncion-manaria/webtur00-content/es/,0.0,0.0,0.0,Patrimonio Cultural,"43.13921790001451,-2.6596506772955375",43.13921790001451,-2.659650677295537
Iglesia parroquial de San Esteban de Lartaun,La iglesia parroquial de San Esteban presenta una única nave y bóvedas de crucer&ia...,Patrimonio cultural,Plaza de San Esteban,Oiartzun,Gipuzkoa,20180.0,Montes y Valles vascos,turismoa@oarsoaldea.eus,943 494 521,,https://turismoa.euskadi.eus/es/patrimonio-cultural/iglesia-parroquial-de-san-esteban-de-lartaun/webtur00-content/es/,1.0,0.0,0.0,Patrimonio Cultural,"43.2998142514947,-1.860673193848461",43.2998142514947,-1.860673193848461
Chalet de Arechaga,"El chalet Arechaga de Ubide fue promovido por Santiago de Arechaga, aunque el actual edificio fue...",Patrimonio cultural,Barrio Madalena,Ubide,Bizkaia,48145.0,Montes y Valles vascos,abengoa@ubide.eus,945 450 322,,https://turismoa.euskadi.eus/es/patrimonio-cultural/chalet-de-arechaga/webtur00-content/es/,0.0,0.0,0.0,Patrimonio Cultural,"43.0223816939253,-2.6859500788208",43.0223816939253,-2.6859500788208
Iglesia de Santa María (Tolosa),"La iglesia de Santa María, de 1.630 metros cuadrados de superficie, está ubicada en...",Patrimonio cultural,Plaza de Santa María,Tolosa,Gipuzkoa,20400.0,Montes y Valles vascos,tour@tolosaldea.eus,943 671 034,,https://turismoa.euskadi.eus/es/patrimonio-cultural/iglesia-de-santa-maria-tolosa/webtur00-content/es/,1.0,0.0,0.0,Patrimonio Cultural,"43.13827871620603,-2.070883239549289",43.13827871620603,-2.070883239549289
Palacio de la Puente,El palacio de la Puente es la estructura arquitectónica más destacable del municipi...,Patrimonio cultural,"La Iglesia, 3",Trucios-Turtzioz,Bizkaia,48880.0,Montes y Valles vascos,turtzioz@bizkaia.org,946 109 604,,https://turismoa.euskadi.eus/es/patrimonio-cultural/palacio-de-la-puente/webtur00-content/es/,0.0,0.0,0.0,Patrimonio Cultural,"43.271738190362115,-3.256593440475408",43.27173819036212,-3.256593440475408
Casa Artzu,"La casa Artzu alberga una larga historia, ya que la primera documentación sobre ella data ...",Patrimonio cultural,Barrio Montaña,Hondarribia,Gipuzkoa,20280.0,Costa Vasca,casartzu@hotmail.es,943 640 530,http://casa-artzu.com/,https://turismoa.euskadi.eus/es/patrimonio-cultural/casa-artzu/webtur00-content/es/,0.0,0.0,0.0,Patrimonio Cultural,"43.3796455,-1.81684469",43.3796455,-1.81684469
Ermita de San Esteban,La ermita de San Esteban está situada a la salida de Oñati en dirección a Ar...,Patrimonio cultural,Barrio Lezesarri,Oñati,Gipuzkoa,20560.0,Montes y Valles vascos,turismo@onati.eus,943 783 453,,https://turismoa.euskadi.eus/es/patrimonio-cultural/ermita-de-san-esteban/webtur00-content/es/,0.0,0.0,0.0,Patrimonio Cultural,"43.0249707794607,-2.4097913745911326",43.0249707794607,-2.409791374591133
Casa Corral Ipeñarrieta (Ayuntamiento),La Casa Corral Ipeñarrieta fue mandada construir por Cristóbal de Ipeñarriet...,Patrimonio cultural,"Calle Iparragirre, 20",Urretxu,Gipuzkoa,20700.0,Montes y Valles vascos,info@urretxu.eus,943 038 080,,https://turismoa.euskadi.eus/es/patrimonio-cultural/casa-corral-ipenarrieta-ayuntamiento/webtur00-content/es/,0.0,0.0,0.0,Patrimonio Cultural,"43.0931349,-2.3137279000000035",43.0931349,-2.3137279000000035
Iglesia de San Pedro de Romaña,La iglesia de San Pedro Romaña es un edificio cuadrado de tres naves y cabecera poligonal;...,Patrimonio cultural,"José Antonio Aguirre, 60",Trucios-Turtzioz,Bizkaia,48880.0,Montes y Valles vascos,ayto.turtzioz@bizkaia.org,946 809 040,,https://turismoa.euskadi.eus/es/patrimonio-cultural/iglesia-de-san-pedro-de-romana/webtur00-content/es/,0.0,0.0,0.0,Patrimonio Cultural,"43.272373327725525,-3.2564729269836423",43.272373327725525,-3.2564729269836423
Ermita de San Juan Bautista,"La ermita de San Juan Bautista, situada a 2 kilómetros del centro urbano de Oñati, ...",Patrimonio cultural,"Garagaltza Auzoa Auzoa, 8",Oñati,Gipuzkoa,20569.0,Montes y Valles vascos,turismo@onati.eus,943 783 453,,https://turismoa.euskadi.eus/es/patrimonio-cultural/ermita-de-san-juan-bautista/webtur00-content/es/,0.0,0.0,0.0,Patrimonio Cultural,"43.03356696946632,-2.4201256955819694",43.03356696946632,-2.420125695581969
Ermita de San Lorenzo (Oñati),La pequeña ermita de San Lorenzo está situada en la recta de entrada a Oñati...,Patrimonio cultural,"San Lorentzo Auzoa Auzoa, 41",Oñati,Gipuzkoa,20560.0,Montes y Valles vascos,turismo@onati.eus,943 783 453,,https://turismoa.euskadi.eus/es/patrimonio-cultural/ermita-de-san-lorenzo-onati/webtur00-content/es/,0.0,0.0,0.0,Patrimonio Cultural,"43.033205126827106,-2.40247484776114",43.03320512682711,-2.40247484776114
Ermita de San Martín,"La ermita de San Martín, situada en una colina y rodeada por el paseo de San Martín...",Patrimonio cultural,Parque de San Martín,Oñati,Gipuzkoa,20560.0,Montes y Valles vascos,turismo@onati.eus,943 783 453,,https://turismoa.euskadi.eus/es/patrimonio-cultural/ermita-de-san-martin/webtur00-content/es/,0.0,0.0,0.0,Patrimonio Cultural,"43.029546573004055,-2.408635768598295",43.029546573004055,-2.408635768598295
Ermita de Santa Lucía,La ermita de Santa Lucía está situada a aproximadamente un kilómetro del cas...,Patrimonio cultural,Barrio Berezao,Oñati,Gipuzkoa,20560.0,Montes y Valles vascos,turismo@onati.eus,943 783 453,,https://turismoa.euskadi.eus/es/patrimonio-cultural/ermita-de-santa-lucia/webtur00-content/es/,0.0,0.0,0.0,Patrimonio Cultural,"43.022524322435274,-2.4043121878052087",43.02252432243528,-2.4043121878052087
Caserío Gurrutxaga Goikoa,"Situada en el barrio de Soraitz, Gurrutxaga Goikoa es un edificio de planta rectangular y tejado ...",Patrimonio cultural,Barrio Soraitz,Zumarraga,Gipuzkoa,20700.0,Montes y Valles vascos,informazioa@zumarraga.eus,943 729 022,,https://turismoa.euskadi.eus/es/patrimonio-cultural/caserio-gurrutxaga-goikoa/webtur00-content/es/,0.0,0.0,0.0,Patrimonio Cultural,"43.09090589160806,-2.3070643957092307",43.09090589160806,-2.3070643957092307
Ermita de San Roque y plaza de toros,"La ermita de San Roque, construida hacia el año 1700 y de estilo barroco popular, se asien...",Patrimonio cultural,Barrio de San Roque,Trucios-Turtzioz,Bizkaia,48880.0,Montes y Valles vascos,turtziozturismobulegoa@gmail.com,946 109 604,,https://turismoa.euskadi.eus/es/patrimonio-cultural/ermita-de-san-roque-y-plaza-de-toros/webtur00-content/es/,0.0,0.0,0.0,Patrimonio Cultural,"43.265083449861166,-3.2523932920654564",43.265083449861166,-3.2523932920654564
Iglesia de Santa María Magdalena,La hermosa iglesia de Santa María se alza en el casco antiguo de Plentzia. Edificio de est...,Patrimonio cultural,"Plaza de la iglesia, 22",Plentzia,Bizkaia,48620.0,Costa Vasca,turismo@plentzia.eus,946 774 199,,https://turismoa.euskadi.eus/es/patrimonio-cultural/iglesia-de-santa-maria-magdalena/webtur00-content/es/,1.0,0.0,0.0,Patrimonio Cultural,"43.405182809935155,-2.9475753922042647",43.40518280993516,-2.9475753922042647
Monumentos megalíticos funerarios (Oleta-Samiño),"Estos monumentos megalíticos se encuentran cerca de la pista que une los montes de Oleta, ...",Patrimonio cultural,Entre los montes de Oleta y Samiño,Zumarraga,Gipuzkoa,20700.0,Montes y Valles vascos,,943 722 042,,https://turismoa.euskadi.eus/es/patrimonio-cultural/monumentos-megaliticos-funerarios-oleta-samino/webtur00-content/es/,0.0,0.0,0.0,Patrimonio Cultural,"43.13088244551273,-2.3176859434081454",43.13088244551273,-2.3176859434081454
Casa Dotorekua,"La casa Dotorekua fue fundada en el siglo XVI por el doctor Juan Ortiz de Zarauz, corregidor de C...",Patrimonio cultural,"Zigordia kalea, 31",Zarautz,Gipuzkoa,20800.0,Costa Vasca,arazi@arazi.eus,943 833 641,,https://turismoa.euskadi.eus/es/patrimonio-cultural/casa-dotorekua/webtur00-content/es/,0.0,0.0,0.0,Patrimonio Cultural,"43.28509344463748,-2.174288524536896",43.28509344463748,-2.174288524536896
