Nombre,Descripción,Tipo de lugar,Dirección,Municipio,Provincia,Postal Code,Marcas,Email,Teléfono,WEB,URL amigable,Visita Guiada,Capacidad,Tienda,Tipo de Cultura,Coordenadas GPS,LATWGS84,LONWGS84
Iglesia de San Juan Evangelista,"La iglesia San Juan Evangelista es del siglo XII, pero desde entonces ha sufrido más de un...",Patrimonio cultural,"Barrio Elizondo, 3",Berriz,Bizkaia,48240.0,Montes y Valles vascos,,946 824 004,,https://turismoa.euskadi.eus/es/patrimonio-cultural/iglesia-de-san-juan-evangelista/webtur00-content/es/,0.0,0.0,0.0,Patrimonio Cultural,"43.17516608918416,-2.57710369206541",43.17516608918416,-2.57710369206541
Santuario de Nuestra Señora de Andikoa,El Santuario de Nuestra Señora de Andikoa es un templo gótico. Lo construyeron en 1...,Patrimonio cultural,Barrio Andikoa,Berriz,Bizkaia,48240.0,Montes y Valles vascos,berriz@berriz.eus,946 824 036,,https://turismoa.euskadi.eus/es/patrimonio-cultural/santuario-de-nuestra-senora-de-andikoa/webtur00-content/es/,0.0,0.0,0.0,Patrimonio Cultural,"43.18620719245134,-2.5911549017136037",43.18620719245134,-2.591154901713604
Ermita de Nuestra Señora de Urrategi,La ermita de Nuestra Señora de Urrategi fue fundada en 1617 por Francisco López de ...,Patrimonio cultural,Barrio Urrategi,Azkoitia,Gipuzkoa,20720.0,Montes y Valles vascos,kultu@azkoitia.eus,943 857 170,,https://turismoa.euskadi.eus/es/patrimonio-cultural/ermita-de-nuestra-senora-de-urrategi/webtur00-content/es/,0.0,0.0,0.0,Patrimonio Cultural,"43.17794227200395,-2.3415784940589246",43.17794227200395,-2.3415784940589246
Casa-Torre Enparan,La antigua Torre de Enparan de Azpeitia se remonta al año 1320. En ella vivieron los ...,Patrimonio cultural,Paseo de los Fueros,Azpeitia,Gipuzkoa,20730.0,Montes y Valles vascos,kultura@azpeitia.eus,943 157 068,https://www.euskadi.eus/app/ondarea/patrimonio-arqueologico/casa-torre-enparan/casa-torre/azpeitia/fichaconsulta/54385,https://turismoa.euskadi.eus/es/patrimonio-cultural/casa-torre-enparan/webtur00-content/es/,0.0,0.0,0.0,Patrimonio Cultural,"43.18441497194785,-2.262703278118132",43.18441497194785,-2.262703278118132
Convento e Iglesia de las Hermanas Concepcionistas Franciscanas,El Convento de las Hermanas Concepcionistas Franciscanas fue construido en el siglo XVI muy cerca...,Patrimonio cultural,"Foru Ibilbidea, 16",Azpeitia,Gipuzkoa,20730.0,Montes y Valles vascos,turismobulegoa@azpeitia.eus,943 811 072,,https://turismoa.euskadi.eus/es/patrimonio-cultural/convento-e-iglesia-de-las-hermanas-concepcionistas-franciscanas/webtur00-content/es/,0.0,0.0,0.0,Patrimonio Cultural,"43.1838764,-2.2634004",43.1838764,-2.2634004
Iglesia de San Severino,"La iglesia de San Severino, del siglo XV, está en la Plaza Mayor de Balmaseda. El edificio...",Patrimonio cultural,"Plaza San Severino, 1",Balmaseda,Bizkaia,48800.0,Montes y Valles vascos,parroquiabalmaseda@euskalnet.net,946 800 074,,https://turismoa.euskadi.eus/es/patrimonio-cultural/iglesia-de-san-severino/webtur00-content/es/,1.0,0.0,0.0,Patrimonio Cultural,"43.196120146297616,-3.1926468797622642",43.196120146297616,-3.192646879762264
Ayuntamiento de Bilbao,"El Ayuntamiento de Bilbao fue construido a finales del siglo XIX, donde estaba el antiguo convent...",Patrimonio cultural,Plaza Ernesto Erkoreka,Bilbao,Bizkaia,48007.0,Bilbao,infobilbao@bilbao.eus,944 204 200,,https://turismoa.euskadi.eus/es/patrimonio-cultural/ayuntamiento-de-bilbao/webtur00-content/es/,0.0,0.0,0.0,Patrimonio Cultural,"43.263858,-2.923088",43.263858,-2.923088
Santuario de Nuestra Señora de la Encina,El Santuario de Nuestra Señora de la Encina es uno de los más impresionantes de &Aa...,Patrimonio cultural,"Cuesta de la Encina, s/n",Artziniega,Araba/Álava,1474.0,Montes y Valles vascos,info@artziniegakoudala.eus,945 39 63 53,,https://turismoa.euskadi.eus/es/patrimonio-cultural/santuario-de-nuestra-senora-de-la-encina/webtur00-content/es/,0.0,0.0,0.0,Patrimonio Cultural,"43.12753035091062,-3.135733973016386",43.12753035091062,-3.135733973016386
Casco Medieval de Artziniega,El casco antiguo de Artziniega tiene las características de una villa medieval construida ...,Patrimonio cultural,,Artziniega,Araba/Álava,1474.0,Montes y Valles vascos,,945 396 210,,https://turismoa.euskadi.eus/es/patrimonio-cultural/casco-medieval-de-artziniega/webtur00-content/es/,1.0,0.0,0.0,Patrimonio Cultural,"43.1205796,-3.1294083999999884",43.1205796,-3.1294083999999884
Ermita de Nuestra Señora de Olatz,La ermita de Nuestra Señora de Olatz se encuentra a medio camino de la recta entre Azpeiti...,Patrimonio cultural,Avenida Loiola,Azpeitia,Gipuzkoa,20730.0,Montes y Valles vascos,i-loiola@urolaturismoa.eus,943 151 878,,https://turismoa.euskadi.eus/es/patrimonio-cultural/ermita-de-nuestra-senora-de-olatz/webtur00-content/es/,0.0,0.0,0.0,Patrimonio Cultural,"43.18006156396316,-2.27856051589969",43.18006156396316,-2.27856051589969
Ermita de Santa María Magdalena,"La Ermita de Santa María Magdalena está situada en la salida del pueblo, junto a la...",Patrimonio cultural,"Magdalena, 11",Azpeitia,Gipuzkoa,20730.0,Montes y Valles vascos,,943 811 142,,https://turismoa.euskadi.eus/es/patrimonio-cultural/ermita-de-santa-maria-magdalena/webtur00-content/es/,0.0,0.0,0.0,Patrimonio Cultural,"43.187867160767595,-2.2629530760574457",43.1878671607676,-2.2629530760574457
Convento de la Encarnación,En el siglo XVI la orden de los dominicos eligió este lugar para construir su convento. Ac...,Patrimonio cultural,Plaza de la Encarnación (Atxuri),Bilbao,Bizkaia,48006.0,Bilbao,museo@eleizmuseoa.com,944 320 125,,https://turismoa.euskadi.eus/es/patrimonio-cultural/convento-de-la-encarnacion/webtur00-content/es/,1.0,0.0,0.0,Patrimonio Cultural,"43.25365375905497,-2.9206153594551165",43.25365375905497,-2.9206153594551165
Edificio de la Hacienda Estatal,El proyecto de este monumental edificio de mediados del siglo XX (1942-1953) corrió a carg...,Patrimonio cultural,"Plaza Moyua, 3",Bilbao,Bizkaia,48009.0,Bilbao,informacion@bilbaoturismo.bilbao.eus,944 795 760,,https://turismoa.euskadi.eus/es/patrimonio-cultural/edificio-de-la-hacienda-estatal/webtur00-content/es/,0.0,0.0,0.0,Patrimonio Cultural,"43.26260238,-2.9354201",43.26260238,-2.9354201
Iglesia de los Santos Juanes,Las obras de la iglesia de los Santos Juanes se iniciaron en 1622 y se terminaron 20 años ...,Patrimonio cultural,"La Cruz, 4",Bilbao,Bizkaia,48005.0,Bilbao,,944 153 997,,https://turismoa.euskadi.eus/es/patrimonio-cultural/iglesia-de-los-santos-juanes/webtur00-content/es/,0.0,0.0,0.0,Patrimonio Cultural,"43.25776656257036,-2.9222017668647595",43.25776656257036,-2.9222017668647595
Iglesia de San Nicolás,"El templo se inauguró en el año 1756, tras trece años de construcción...",Patrimonio cultural,"Plaza San Nicolás, 1 (Casco Viejo)",Bilbao,Bizkaia,48005.0,Bilbao,p.sannicolas.bilbao@bizkeliza.org,944 163 424,,https://turismoa.euskadi.eus/es/patrimonio-cultural/iglesia-de-san-nicolas/webtur00-content/es/,0.0,0.0,0.0,Patrimonio Cultural,"43.26011904873632,-2.922576122684637",43.26011904873632,-2.922576122684637
Iglesia de San Pedro,La iglesia de San Pedro de Deusto se proyectó en torno al año 1515. Se trata de un ...,Patrimonio cultural,"Plaza San Pedro, 1 (Deusto)",Bilbao,Bizkaia,48014.0,Bilbao,p.sanpedro.bilbao@bizkeliza.org,944 754 964,,https://turismoa.euskadi.eus/es/patrimonio-cultural/iglesia-de-san-pedro/webtur00-content/es/,0.0,0.0,0.0,Patrimonio Cultural,"43.272299863423996,-2.9455323581475934",43.272299863424,-2.9455323581475934
Iglesia de San Vicente Mártir de Abando,"La actual iglesia comenzó a construirse a mediados del siglo XVI, aunque la Anteiglesia de...",Patrimonio cultural,"Ibañez de Bilbao, 18",Bilbao,Bizkaia,48001.0,Bilbao,parroquia@sanvicentemartirdeabando.org,944 231 296,http://sanvicentemartirdeabando.org/,https://turismoa.euskadi.eus/es/patrimonio-cultural/iglesia-de-san-vicente-martir-de-abando/webtur00-content/es/,0.0,0.0,0.0,Patrimonio Cultural,"43.263545193556446,-2.9279132625656623",43.263545193556446,-2.9279132625656623
Parque de Doña Casilda Iturrizar,En el plan del Ensanche de Bilbao de 1876 ya habían proyectado realizar un parque en este ...,Patrimonio cultural,Entre el Palacio Euskalduna y el Museo de Bellas Artes,Bilbao,Bizkaia,48011.0,Bilbao,informacion@bilbaoturismo.bilbao.net,944 795 760,,https://turismoa.euskadi.eus/es/patrimonio-cultural/parque-de-dona-casilda-iturrizar/webtur00-content/es/,0.0,0.0,0.0,Patrimonio Cultural,"43.265679,-2.940352",43.265679,-2.940352
Teatro Campos Elíseos,El Campos Elíseos de Bilbao es el mejor ejemplo de la arquitectura de Art Nouveau de ...,Patrimonio cultural,"Bertendona, 3 bis",Bilbao,Bizkaia,48008.0,Bilbao,taquillacampos@klemark.com,944 438 610,https://www.teatrocampos.com/,https://turismoa.euskadi.eus/es/patrimonio-cultural/teatro-campos-eliseos/webtur00-content/es/,0.0,0.0,0.0,Patrimonio Cultural,"43.26031694,-2.93169815",43.26031694,-2.93169815
Iglesia de la Asunción de Santa María (Lekeitio),La iglesia parroquial de la Asunción de Santa María de Lekeitio es un incompar...,Patrimonio cultural,Plaza de la Independencia,Lekeitio,Bizkaia,48280.0,Costa Vasca,turismo@lekeitio.eus,946 844 017,,https://turismoa.euskadi.eus/es/patrimonio-cultural/iglesia-de-la-asuncion-de-santa-maria/webtur00-content/es/,0.0,0.0,0.0,Patrimonio Cultural,"43.36346020012614,-2.502711863754268",43.36346020012614,-2.502711863754268
Iglesia de Santa María de Axpe,"Se desconoce la fecha de construcción de este templo religioso, pero la localizació...",Patrimonio cultural,"Barrio de Axpe, 2",Busturia,Bizkaia,48350.0,"Costa Vasca,Montes y Valles vascos",alkatea.busturia@bizkaia.org,946 870 050,,https://turismoa.euskadi.eus/es/patrimonio-cultural/iglesia-de-santa-maria-de-axpe/webtur00-content/es/,0.0,0.0,0.0,Patrimonio Cultural,"43.38250885645948,-2.7006218196822873",43.38250885645948,-2.700621819682288
Palacio de Chirapozu,"El origen de esta casa se remonta al año 1791. Manuel de Chirapozu, nacido en Busturia per...",Patrimonio cultural,Barrio de Altamira,Busturia,Bizkaia,48350.0,"Costa Vasca,Montes y Valles vascos",,,,https://turismoa.euskadi.eus/es/patrimonio-cultural/palacio-de-chirapozu/webtur00-content/es/,0.0,0.0,0.0,Patrimonio Cultural,"43.3686774125793,-2.7038618150970684",43.3686774125793,-2.7038618150970684
Molino de Zamakola,"Aunque se desconoce la fecha de su fundación, se sabe que en este lugar existía un ...",Patrimonio cultural,Barrio Indusi,Dima,Bizkaia,48141.0,Montes y Valles vascos,,946 315 818,,https://turismoa.euskadi.eus/es/patrimonio-cultural/molino-de-zamakola/webtur00-content/es/,1.0,0.0,0.0,Patrimonio Cultural,"43.116919412204155,-2.725833378018261",43.11691941220416,-2.725833378018261
Central hidroeléctrica Errotazar,En 1910 Doña Flora L. De Heredia recibió la concesión de aprovechar las agua...,Patrimonio cultural,"Barrio Indusi, 25",Dima,Bizkaia,48141.0,Montes y Valles vascos,,659 803 506,,https://turismoa.euskadi.eus/es/patrimonio-cultural/central-hidroelectrica-errotazar/webtur00-content/es/,1.0,0.0,0.0,Patrimonio Cultural,"43.1208851,-2.73342",43.1208851,-2.73342
Cuevas de Pozalagua,Una verdadera catedral subterránea. Con 125 metros de longitud aproximadamente y cuatro si...,Patrimonio cultural,A 2 kilómetros del barrio de Ranero,Karrantza Harana/Valle de Carranza,Bizkaia,48891.0,Montes y Valles vascos,turismo@karrantza.org,649 811 673,https://www.cuevadepozalagua.eus/,https://turismoa.euskadi.eus/es/patrimonio-cultural/cuevas-de-pozalagua/webtur00-content/es/,1.0,0.0,0.0,Patrimonio Cultural,"43.26164746077004,-3.384773419943258",43.26164746077004,-3.384773419943258
Convento de los Agustinos Descalzos (San Agustin Kultur Gunea),El convento de los Agustinos Descalzos estaba compuesto por la iglesia y la residencia. Fue const...,Patrimonio cultural,"San Agustinalde, 12",Durango,Bizkaia,48200.0,Montes y Valles vascos,sanagustin@durango.eus,946 030 021,https://www.durango.eus/sanagustin,https://turismoa.euskadi.eus/es/patrimonio-cultural/convento-de-los-agustinos-descalzos-san-agustin-kultur-gunea/webtur00-content/es/,1.0,0.0,0.0,Patrimonio Cultural,"43.16736257096352,-2.632894200000002",43.16736257096352,-2.632894200000002
Arco de Santa Ana,El arco de Santa Ana es la única de las puertas de entrada que queda de la antig...,Patrimonio cultural,Plaza Santa Ana,Durango,Bizkaia,48200.0,Montes y Valles vascos,turismo@durango.eus,946 033 938,,https://turismoa.euskadi.eus/es/patrimonio-cultural/arco-de-santa-ana/webtur00-content/es/,1.0,0.0,0.0,Patrimonio Cultural,"43.165943284789336,-2.631991878573605",43.165943284789336,-2.631991878573605
Casa Consistorial de Durango,"El edificio del Ayuntamiento de Durango fue edificado en el siglo XVI, pero debido a lo...",Patrimonio cultural,"Zeharkalea, 3",Durango,Bizkaia,48200.0,Montes y Valles vascos,turismo@durango.eus,946 033 938,,https://turismoa.euskadi.eus/es/patrimonio-cultural/casa-consistorial-de-durango/webtur00-content/es/,1.0,0.0,0.0,Patrimonio Cultural,"43.16706433539833,-2.6320348914016445",43.16706433539833,-2.6320348914016445
Cruz de Kurutziaga,La cruz de Kurutziaga fue erigida en el siglo XV y por sus características es una pieza &u...,Patrimonio cultural,"Kurutziaga, 38 (Ermita de Vera Cruz)",Durango,Bizkaia,48200.0,Montes y Valles vascos,turismo@durango.eus,946 033 938,,https://turismoa.euskadi.eus/es/patrimonio-cultural/cruz-de-kurutziaga/webtur00-content/es/,1.0,0.0,0.0,Patrimonio Cultural,"43.168322551489034,-2.6293002775238428",43.16832255148904,-2.6293002775238428
Iglesia de San Pedro de Tabira,"La iglesia de San Pedro de Tabira se construyó en el siglo XVI, donde estaba una iglesia m...",Patrimonio cultural,"Tabirabide kalea, 37",Durango,Bizkaia,48200.0,Montes y Valles vascos,turismo@durango.eus,946 033 938,,https://turismoa.euskadi.eus/es/patrimonio-cultural/iglesia-de-san-pedro-de-tabira/webtur00-content/es/,0.0,0.0,0.0,Patrimonio Cultural,"43.16098749900043,-2.631603177107311",43.16098749900043,-2.631603177107311
Iglesia San Juan Evangelista,La iglesia parroquial de San Juan Evangelista se encuentra en la parte alta del centro urbano de ...,Patrimonio cultural,Barrio San Miguel,Garai,Bizkaia,48200.0,Montes y Valles vascos,udala@garai-udala.eus,946 816 393,http://www.garai-udala.eus,https://turismoa.euskadi.eus/es/patrimonio-cultural/iglesia-san-juan-evangelista/webtur00-content/es/,0.0,0.0,0.0,Patrimonio Cultural,"43.19449745166019,-2.6126519539977933",43.19449745166019,-2.6126519539977933
Ermita de Santa Catalina,"Los primeros documentos referentes a esta iglesia datan del año 1539.Durante siglos, esta ...",Patrimonio cultural,"Barrio Egia, 10",Deba,Gipuzkoa,20820.0,Costa Vasca,turismoa@deba.eus,943 192 452,,https://turismoa.euskadi.eus/es/patrimonio-cultural/ermita-de-santa-catalina/webtur00-content/es/,0.0,0.0,0.0,Patrimonio Cultural,"43.29856184998231,-2.342975728836103",43.29856184998231,-2.342975728836103
Palacio de Lazarraga,El Palacio Lazarraga se construyó en la segunda mitad del siglo XVI. Se trata de un edific...,Patrimonio cultural,"Zalduondo, s/n",Zalduondo,Araba/Álava,1208.0,Montes y Valles vascos,,945 304 393,,https://turismoa.euskadi.eus/es/patrimonio-cultural/palacio-de-lazarraga/webtur00-content/es/,0.0,0.0,0.0,Patrimonio Cultural,"42.8854919,-2.34620289999998",42.8854919,-2.34620289999998
Torre de Negorta,"Según las investigaciones que se han llevado a cabo sobre la Torre Negorta, se cree que fu...",Patrimonio cultural,Barrio El Valle,Ayala/Aiara,Araba/Álava,1477.0,Montes y Valles vascos,,945 399 251,,https://turismoa.euskadi.eus/es/patrimonio-cultural/torre-de-negorta/webtur00-content/es/,1.0,0.0,0.0,Patrimonio Cultural,"43.10073219837594,-3.0480194091796875",43.10073219837594,-3.0480194091796875
Palacio Garai Goitia,"El palacio Garai Goitia, ubicado en el centro del núcleo municipal de Garai, es un hist&oa...",Patrimonio cultural,Barrio San Miguel,Garai,Bizkaia,48200.0,Montes y Valles vascos,,946 816 393,,https://turismoa.euskadi.eus/es/patrimonio-cultural/palacio-garai-goitia/webtur00-content/es/,0.0,0.0,0.0,Patrimonio Cultural,"43.193824782595875,-2.6119974949981595",43.19382478259588,-2.6119974949981595
Ermita de Santa Cruz,"La pequeña ermita de Santa Cruz está emplazada frente a la casa consistorial, en la...",Patrimonio cultural,"Cruz, 10",Deba,Gipuzkoa,20820.0,Costa Vasca,turismoa@deba.eus,943 192 452,,https://turismoa.euskadi.eus/es/patrimonio-cultural/ermita-de-santa-cruz/webtur00-content/es/,0.0,0.0,0.0,Patrimonio Cultural,"43.29391369261296,-2.353262624536905",43.29391369261296,-2.353262624536905
Parroquia de San Sebastián de Soreasu,En pleno casco histórico de la villa se encuentra desde la Edad Media la Parroquia de San ...,Patrimonio cultural,"Eliz Kalea, 25",Azpeitia,Gipuzkoa,20730.0,Montes y Valles vascos,i-loiola@urolaturismo.eus,943 811 142,,https://turismoa.euskadi.eus/es/patrimonio-cultural/parroquia-de-san-sebastian-de-soreasu/webtur00-content/es/,1.0,0.0,0.0,Patrimonio Cultural,"43.185887560884105,-2.2642475576720855",43.185887560884105,-2.264247557672085
Iglesia de Santa María (Ondarroa),La iglesia de Santa María fue construida sobre una gran roca y permanece solemne en la par...,Patrimonio cultural,Plaza Pedro María Unanue,Ondarroa,Bizkaia,48700.0,Costa Vasca,turismobulegoa@ondarroa.eus,946 831 951,,https://turismoa.euskadi.eus/es/patrimonio-cultural/iglesia-de-santa-maria-ondarroa/webtur00-content/es/,1.0,0.0,0.0,Patrimonio Cultural,"43.32151227020711,-2.4242237403366307",43.32151227020711,-2.4242237403366307
Cofradia Vieja y Zubi Zaharra,El Puente Viejo o Zubi Zaharra y la Cofradía Vieja son unos de los lugares con más ...,Patrimonio cultural,Kanttoipe,Ondarroa,Bizkaia,48700.0,Costa Vasca,turismobulegoa@ondarroa.eus,946 831 951,,https://turismoa.euskadi.eus/es/patrimonio-cultural/cofradia-vieja-y-zubi-zaharra/webtur00-content/es/,1.0,0.0,0.0,Patrimonio Cultural,"43.32026913451072,-2.422095957949826",43.32026913451072,-2.422095957949826
Casa Torre de los Loiola,"La Casa Torre de los Loiola es la casa en la que nació San Ignacio, fundador de la Compa&n...",Patrimonio cultural,"Carretera GI-631, entre Azkoitia y Azpeitia (Santuario de Loiola)",Azpeitia,Gipuzkoa,20730.0,Montes y Valles vascos,visitas@santuariodeloyola.org,943 025 000,https://loyola.global/es/casa-natal-de-san-ignacio,https://turismoa.euskadi.eus/es/patrimonio-cultural/casa-torre-de-los-loiola/webtur00-content/es/,1.0,0.0,1.0,Patrimonio Cultural,"43.174120857885534,-2.2824016650650103",43.174120857885534,-2.2824016650650103
Canteras de Andrabide,"En la carretera que une los municipios de Gautegiz-Arteaga y Ereño, se encuentran una seri...",Patrimonio cultural,Barrio Andrabide,Gautegiz Arteaga,Bizkaia,48314.0,"Costa Vasca,Montes y Valles vascos",udala@gautegizarteaga.eus,946 252 953,https://turismogautegizarteaga.eus/,https://turismoa.euskadi.eus/es/patrimonio-cultural/canteras-de-andrabide/webtur00-content/es/,0.0,0.0,0.0,Patrimonio Cultural,"43.35962556272009,-2.633754489288329",43.35962556272009,-2.633754489288329
Palacio Patrokua,El palacio de Patrokua era residencia del linaje de los Barroeta.En su construcción se dif...,Patrimonio cultural,"Avenida de Xemein, 13",Markina-Xemein,Bizkaia,48270.0,Montes y Valles vascos,mankomunitatea@lea-artibai.org,946 169 068,,https://turismoa.euskadi.eus/es/patrimonio-cultural/palacio-patrokua/webtur00-content/es/,1.0,0.0,0.0,Patrimonio Cultural,"43.267287512354855,-2.4949452718276444",43.267287512354855,-2.4949452718276444
Iglesia parroquial de Santa María,La iglesia parroquial de Santa María es una de las más majestuosas de Gipuzkoa. Se ...,Patrimonio cultural,"Plaza Zaharra, 7",Deba,Gipuzkoa,20820.0,Costa Vasca,turismoa@deba.eus,943 191 497,,https://turismoa.euskadi.eus/es/patrimonio-cultural/iglesia-parroquial-de-santa-maria/webtur00-content/es/,1.0,0.0,0.0,Patrimonio Cultural,"43.2947596323469,-2.353492853967285",43.2947596323469,-2.353492853967285
Ermita de San Miguel de Arretxinaga,"La ermita de San Miguel de Arretxinaga fue construida en el siglo XVIII, puesto que la anterior e...",Patrimonio cultural,"Arretxinaga, 24",Markina-Xemein,Bizkaia,48270.0,Montes y Valles vascos,kulturgunea@uhagon.com,946 166 303,,https://turismoa.euskadi.eus/es/patrimonio-cultural/ermita-de-san-miguel-de-arretxinaga/webtur00-content/es/,0.0,0.0,0.0,Patrimonio Cultural,"43.27146862049516,-2.495098769172719",43.27146862049516,-2.495098769172719
Iglesia y cementerio de Santa María de la Asunción de Xemein,La iglesia de Santa María de la Asunción de Xemein es un templo del siglo XVI.Const...,Patrimonio cultural,Barrio de Arretxinaga,Markina-Xemein,Bizkaia,48270.0,Montes y Valles vascos,info@leaartibaiturismo.com,946 844 017,,https://turismoa.euskadi.eus/es/patrimonio-cultural/iglesia-y-cementerio-de-santa-maria-de-la-asuncion-de-xemein/webtur00-content/es/,1.0,0.0,0.0,Patrimonio Cultural,"43.26741847365497,-2.4931790541722942",43.26741847365497,-2.4931790541722942
Dolmen de Larrarte,"El dolmen de Larrarte está situado en el collado del mismo nombre, al que se accede desde ...",Patrimonio cultural,Barrio Astigarreta,Beasain,Gipuzkoa,20200.0,Montes y Valles vascos,udala@beasain.eus,943 028 065,https://www.beasain.eus,https://turismoa.euskadi.eus/es/patrimonio-cultural/dolmen-de-larrarte/webtur00-content/es/,0.0,0.0,0.0,Patrimonio Cultural,"43.086749076604946,-2.2158592992919846",43.08674907660495,-2.215859299291985
Ermita de Nuestra Señora de Loinaz,La primera mención histórica de este templo data del año 1565. Se trata de u...,Patrimonio cultural,Barrio Loinaz,Beasain,Gipuzkoa,20200.0,Montes y Valles vascos,igartza@beasain.eus,943 087 798,,https://turismoa.euskadi.eus/es/patrimonio-cultural/ermita-de-nuestra-senora-de-loinaz/webtur00-content/es/,0.0,0.0,0.0,Patrimonio Cultural,"43.04868933,-2.21424698",43.04868933,-2.21424698
Castillo de Arteaga,"El hermoso Castillo de Arteaga, situado en un lugar privilegiado en el corazón de la reser...",Patrimonio cultural,"Gaztelubide, 7 (Barrio Zelaieta)",Gautegiz Arteaga,Bizkaia,48314.0,"Costa Vasca,Montes y Valles vascos",info@castillodearteaga.com,946 240 012,,https://turismoa.euskadi.eus/es/patrimonio-cultural/castillo-de-arteaga/webtur00-content/es/,0.0,0.0,0.0,Patrimonio Cultural,"43.35197980517232,-2.654289261377012",43.35197980517232,-2.654289261377012
Convento Hospital de Sasiola,"A comienzos del siglo XVI, la Orden de San Francisco de la Observancia intentó fundar un c...",Patrimonio cultural,Carretera Deba-Mendaro (Barrio Sasiola),Deba,Gipuzkoa,20820.0,Costa Vasca,turismoa@deba.eus,943 192 452,,https://turismoa.euskadi.eus/es/patrimonio-cultural/convento-hospital-de-sasiola/webtur00-content/es/,0.0,0.0,0.0,Patrimonio Cultural,"43.2733145,-2.3714685",43.2733145,-2.3714685
Castillo de Muñatones,El Castillo de Muñatones es el resultado de un largo proceso de construcción que se...,Patrimonio cultural,"Barrio San Martín, s/n",Muskiz,Bizkaia,48550.0,Costa Vasca,elpobal@bizkaia.eus,946 706 000,,https://turismoa.euskadi.eus/es/patrimonio-cultural/castillo-de-munatones/webtur00-content/es/,0.0,0.0,0.0,Patrimonio Cultural,"43.32390546463212,-3.1091737747192383",43.32390546463212,-3.1091737747192383
Basílica de Santa María de Uribarri,La basílica de Santa María de Uribarri se construyó en el siglo XVI pegada a...,Patrimonio cultural,"Calle Kanpantorrosteta, 9",Durango,Bizkaia,48200.0,Montes y Valles vascos,turismo@durango.eus,946 200 098,,https://turismoa.euskadi.eus/es/patrimonio-cultural/basilica-de-santa-maria-de-uribarri/webtur00-content/es/,1.0,0.0,0.0,Patrimonio Cultural,"43.16812282861293,-2.6310996929022235",43.16812282861293,-2.6310996929022235
Palacio de Etxezarreta,Este lujoso palacio barroco fue edificado por José Agustín de Etxezarreta hacia 176...,Patrimonio cultural,"San Agustinalde, 16",Durango,Bizkaia,48200.0,Montes y Valles vascos,turismo@durango.eus,946 030 020,https://es.durangomuseoa.eus/,https://turismoa.euskadi.eus/es/patrimonio-cultural/palacio-de-etxezarreta/webtur00-content/es/,0.0,0.0,0.0,Patrimonio Cultural,"43.16688914954627,-2.633056113491876",43.16688914954627,-2.633056113491876
Iglesia de Santa Ana,La iglesia Santa Ana de Durango es un templo del siglo XV que fue ampliado en 1540 y en el s...,Patrimonio cultural,"Plaza de Santa Ana, 7",Durango,Bizkaia,48200.0,Montes y Valles vascos,turismo@durango.eus,946 810 219,,https://turismoa.euskadi.eus/es/patrimonio-cultural/iglesia-de-santa-ana/webtur00-content/es/,1.0,0.0,0.0,Patrimonio Cultural,"43.16553854135364,-2.631784355819724",43.16553854135364,-2.631784355819724
Torre Sasiola,"La Torre Sasiola, construida en la Edad Media como vivienda y fuerte, conserva todavía hoy...",Patrimonio cultural,Calle Osio (Arrabal de Maxpe),Deba,Gipuzkoa,20820.0,Costa Vasca,turismoa@deba.eus,943 192 452,,https://turismoa.euskadi.eus/es/patrimonio-cultural/torre-sasiola/webtur00-content/es/,0.0,0.0,0.0,Patrimonio Cultural,"43.29088118766112,-2.3566167093315094",43.29088118766112,-2.3566167093315094
Iglesia de San Andrés (Ibarrangelu),"La iglesia de San Andrés, ubicada en una ladera del núcleo municipal de Ibarrangelu...",Patrimonio cultural,Barrio Elejalde,Ibarrangelu,Bizkaia,48311.0,Costa Vasca,udala.ibarrangelu@bizkaia.org,946 276 004,,https://turismoa.euskadi.eus/es/patrimonio-cultural/iglesia-de-san-andres-ibarrangelu/webtur00-content/es/,0.0,0.0,0.0,Patrimonio Cultural,"43.39033611273141,-2.6313687744427625",43.39033611273141,-2.6313687744427625
Molino de marea Ozollo Errota,El municipio de Gautegiz-Arteaga conserva el único molino harinero de mareas que antiguame...,Patrimonio cultural,Barrio Ozollo,Gautegiz Arteaga,Bizkaia,48314.0,"Costa Vasca,Montes y Valles vascos",udala@gautegizarteaga.eus,946 252 953,,https://turismoa.euskadi.eus/es/patrimonio-cultural/molino-de-marea-ozollo-errota/webtur00-content/es/,0.0,0.0,0.0,Patrimonio Cultural,"43.35473243181478,-2.6639747725220198",43.35473243181478,-2.66397477252202
