Nombre,Descripción,Tipo de lugar,Dirección,Municipio,Provincia,Postal Code,Marcas,Email,Teléfono,WEB,URL amigable,Visita Guiada,Capacidad,Tienda,Tipo de Cultura,Coordenadas GPS,LATWGS84,LONWGS84
Puerto de Ondarroa,"El puerto de Ondarroa, situado en la desembocadura del río Artibai, es uno de los muelles ...",Puertos pesqueros,"Muelle Egidazu, s/n",Ondarroa,Bizkaia,48700.0,Costa Vasca,,946 830 807,,https://turismoa.euskadi.eus/es/puertos-pesqueros/puerto-de-ondarroa/webtur00-content/es/,0.0,0.0,0.0,Patrimonio Cultural,"43.324412725906534,-2.4204771232988365",43.32441272590653,-2.4204771232988365
Puerto de Plentzia,"El puerto de Plentzia, más conocido como ""La Gallarda"", se ubica en el interior ...",Puertos pesqueros,"Arraun Kalea, 2",Plentzia,Bizkaia,48620.0,Costa Vasca,,944 361 706,,https://turismoa.euskadi.eus/es/puertos-pesqueros/puerto-de-plentzia/webtur00-content/es/,0.0,0.0,0.0,Patrimonio Cultural,"43.40733685173026,-2.945371243377628",43.40733685173026,-2.945371243377628
Puerto de Deba,"El histórico puerto de Deba, desde el que antiguamente se exportaba la lana castellana al ...",Puertos pesqueros,Paseo Ana Sarrina,Deba,Gipuzkoa,20820.0,Costa Vasca,mutriku@ekpsa.eus,943 603 326,,https://turismoa.euskadi.eus/es/puertos-pesqueros/puerto-de-deba/webtur00-content/es/,0.0,0.0,0.0,Patrimonio Cultural,"43.292887951939505,-2.355966567993164",43.29288795193951,-2.355966567993164
Puerto de San Sebastián,El puerto de San Sebastián se encuentra en el extremo oriental de la bahía de La Co...,Puertos pesqueros,"Kaia, 23",Donostia / San Sebastián,Gipuzkoa,20003.0,"Costa Vasca,San Sebastián",donostia@ekpsa.eus,943 000 464,,https://turismoa.euskadi.eus/es/puertos-pesqueros/puerto-de-san-sebastian/webtur00-content/es/,0.0,0.0,0.0,Patrimonio Cultural,"43.3229458739764,-1.9904570609509342",43.3229458739764,-1.9904570609509344
Puerto de Getaria,"El puerto de Getaria, entre la localidad y la isla de San Antón, es uno de los refugios m&...",Puertos pesqueros,"Puerto, 28",Getaria,Gipuzkoa,20808.0,Costa Vasca,getaria@ekpsa.eus,943 896 129,http://www.ekpsa.eus,https://turismoa.euskadi.eus/es/puertos-pesqueros/puerto-de-getaria/webtur00-content/es/,0.0,0.0,0.0,Patrimonio Cultural,"43.30659979,-2.199544043278805",43.30659979,-2.199544043278805
Puerto de Hondarribia,Nos encontramos ante uno de los puertos de bajura más importantes de la costa vasca.C...,Puertos pesqueros,"Ramon Iribarren Pasealekua Ibilbidea, 29",Hondarribia,Gipuzkoa,20280.0,Costa Vasca,hondarribia@ekpsa.eus,943 641 711,,https://turismoa.euskadi.eus/es/puertos-pesqueros/puerto-de-hondarribia/webtur00-content/es/,0.0,0.0,0.0,Patrimonio Cultural,"43.379109252292885,-1.798071821734648",43.379109252292885,-1.798071821734648
Puerto de Mutriku,"El puerto de Mutriku se emplaza en una pequeña cala de la costa, mientras que el propio mu...",Puertos pesqueros,"Muelle San Pedro, s/n",Mutriku,Gipuzkoa,20830.0,Costa Vasca,mutriku@ekpsa.eus,943 603 326,,https://turismoa.euskadi.eus/es/puertos-pesqueros/puerto-de-mutriku/webtur00-content/es/,0.0,0.0,0.0,Patrimonio Cultural,"43.307717761430446,-2.384053299336295",43.307717761430446,-2.384053299336295
Puerto de Orio,"Se trata del típico puerto de ría, ubicado en la desembocadura del Oria, con un mue...",Puertos pesqueros,"Hondartza Bidea, 32 bajo 1. Edificio Capitanía",Orio,Gipuzkoa,20810.0,Costa Vasca,orio@ekpsa.eus,943 249 400,,https://turismoa.euskadi.eus/es/puertos-pesqueros/puerto-de-orio/webtur00-content/es/,0.0,0.0,0.0,Patrimonio Cultural,"43.28418182432822,-2.1270100000000336",43.28418182432822,-2.1270100000000336
Puerto de Zumaia,"El puerto de Zumaia se halla en el estuario del río Urola.Actualmente, apenas desempe&ntil...",Puertos pesqueros,Barrio Santiago,Zumaia,Gipuzkoa,20750.0,Costa Vasca,,943 860 087,,https://turismoa.euskadi.eus/es/puertos-pesqueros/puerto-de-zumaia/webtur00-content/es/,0.0,0.0,0.0,Patrimonio Cultural,"43.29651125149814,-2.254267930984497",43.29651125149814,-2.254267930984497
Palacio de Congresos Europa,"Con una ubicación estratégica, está situado en una de las principales arteri...",Auditorios; Museos; Galerías de arte y salas de exposiciones,"Avenida de Gasteiz, 85",Vitoria-Gasteiz,Araba/Álava,1009.0,Vitoria-Gasteiz,congrestur@vitoria-gasteiz.org,945 161 520,https://www.vitoria-gasteiz.org/we001/was/we001Action.do?idioma=es&accionWe001=ficha&accion=espaciosCongresos,https://turismoa.euskadi.eus/es/museos/palacio-de-congresos-europa/webtur00-content/es/,0.0,0.0,0.0,Patrimonio Cultural,"42.85207335,-2.68106778",42.85207335,-2.68106778
Auditorio Kursaal Palacio de Congresos,"Junto a la playa de la Zurriola se encuentra el Palacio Kursaal, sede anual del Festival Internac...",Auditorios; Museos; Galerías de arte y salas de exposiciones,"Avenida de la Zurriola, 1",Donostia / San Sebastián,Gipuzkoa,20002.0,San Sebastián,kursaal@kursaal.eus,943 003 000,http://www.kursaal.eus,https://turismoa.euskadi.eus/es/museos/auditorio-kursaal-palacio-de-congresos/webtur00-content/es/,0.0,2430.0,0.0,Patrimonio Cultural,"43.32429353,-1.97882036",43.32429353,-1.97882036
Monasterio de Zenarruza,"Declarado Monumento Nacional de Euskadi, el Monasterio de Zenarruza, antigua colegiata, se encuen...",Patrimonio cultural,CL Zenarruza 11,Ziortza-Bolibar,Bizkaia,48279.0,Montes y Valles vascos,comunidad@monasteriozenarruza.net,946 164 179,https://monasteriozenarruza.net/,https://turismoa.euskadi.eus/es/patrimonio-cultural/monasterio-de-zenarruza/webtur00-content/es/,1.0,0.0,1.0,Patrimonio Cultural,"43.24845524092432,-2.561749469311503",43.24845524092432,-2.561749469311503
Iglesia de San Antón,El trazado de la iglesia de San Antón (también denominada San Antonio Abad) forma p...,Patrimonio cultural,"Ribera, 24",Bilbao,Bizkaia,48005.0,Bilbao,f.canizares@artisplendore.com,944 154 262,,https://turismoa.euskadi.eus/es/patrimonio-cultural/iglesia-de-san-anton/webtur00-content/es/,0.0,0.0,0.0,Patrimonio Cultural,"43.255144741110605,-2.9232169344180736",43.255144741110605,-2.9232169344180736
Koldo Mitxelena Kulturunea,Koldo Mitxelena Kulturunea es un equipamiento cultural de la Diputación Foral de Gipuzkoa ...,Auditorios; Museos; Galerías de arte y salas de exposiciones,"Urdaneta, 9",Donostia / San Sebastián,Gipuzkoa,20006.0,San Sebastián,km1@gipuzkoa.eus,943 112 760,https://kmk.gipuzkoa.eus/eu/,https://turismoa.euskadi.eus/es/museos/koldo-mitxelena-kulturunea/webtur00-content/es/,1.0,0.0,0.0,Patrimonio Cultural,"43.31607351,-1.98163202",43.31607351,-1.98163202
Catedral de Santiago,"La catedral, ubicada en el corazón del Casco Viejo de Bilbao, está dedicada al ap&o...",Patrimonio cultural,"Plaza de Santiago, 1",Bilbao,Bizkaia,48005.0,Bilbao,catedraldebilbao@gmail.com,944 153 627,http://catedralbilbao.com/,https://turismoa.euskadi.eus/es/patrimonio-cultural/catedral-de-santiago/webtur00-content/es/,1.0,0.0,0.0,Patrimonio Cultural,"43.25728112615832,-2.9238770104754663",43.25728112615832,-2.9238770104754663
Teatro Victoria Eugenia,"El Teatro Victoria Eugenia, ubicado en la zona céntrica de San Sebastián, es uno de...",Teatros y Cines,"C/ República Argentina, 2",Donostia / San Sebastián,Gipuzkoa,20004.0,"Costa Vasca,San Sebastián",victoria_eugenia@donostia.eus,943 481 160,http://www.victoriaeugenia.eus,https://turismoa.euskadi.eus/es/teatros-cines/teatro-victoria-eugenia/webtur00-content/es/,0.0,900.0,0.0,Patrimonio Cultural,"43.32202,-1.980022",43.32202,-1.980022
Ermita de San Pelaio,La pequeña ermita de San Pelaio está situada entre Bakio y el cabo Matxitxako. Es u...,Patrimonio cultural,Barrio San Pelaio,Bakio,Bizkaia,48130.0,Costa Vasca,turismo@bakio.org,946 193 395,,https://turismoa.euskadi.eus/es/patrimonio-cultural/ermita-de-san-pelaio/webtur00-content/es/,1.0,0.0,0.0,Patrimonio Cultural,"43.43742614499594,-2.783827059835864",43.43742614499594,-2.783827059835864
Basílica de Begoña,"La Basílica de la Virgen de Begoña, patrona de Bizkaia, domina Bilbao desde un cerc...",Patrimonio cultural,"Calle Virgen de Begoña, 38",Bilbao,Bizkaia,48006.0,Bilbao,,944 127 091,,https://turismoa.euskadi.eus/es/patrimonio-cultural/basilica-de-begona/webtur00-content/es/,0.0,0.0,1.0,Patrimonio Cultural,"43.25879028,-2.91408392",43.25879028,-2.91408392
Palacio de la Diputación de Bizkaia,El Palacio de la Diputación de Bizkaia es el mejor ejemplo del eclecticismo dentro del art...,Patrimonio cultural,Gran Vía Don Diego López de Haro 25,Bilbao,Bizkaia,48009.0,Bilbao,bisitak@bizkaia.eus,946 083 537,http://web.bizkaia.eus/es,https://turismoa.euskadi.eus/es/patrimonio-cultural/palacio-de-la-diputacion-de-bizkaia/webtur00-content/es/,1.0,0.0,0.0,Patrimonio Cultural,"43.26217945,-2.9320655",43.26217945,-2.9320655
San Juan de Gaztelugatxe,"San Juan de Gaztelugatxe, un destino #TopEuskadi: Para acceder a la Ermita de San Juan de Gaztelu...",Patrimonio cultural,Isla de Gaztelugatxe (carretera Bermeo-Bakio),Bermeo,Bizkaia,48370.0,Costa Vasca,turismoa@bermeo.org,946 179 154,https://turismo.euskadi.eus/es/san-juan-de-gaztelugatxe/webtur00-recursostop/es/,https://turismoa.euskadi.eus/es/san-juan-de-gaztelugatxe/webtur00-content/es/,0.0,0.0,0.0,Patrimonio Cultural,"43.447281973705856,-2.78498138629152",43.447281973705856,-2.78498138629152
Iglesia de Andra Mari,La Iglesia de Andra Mari o Santa María es el edificio religioso más antiguo de Gald...,Patrimonio cultural,Barrio Elexalde,Galdakao,Bizkaia,48960.0,Montes y Valles vascos,,944 010 500,,https://turismoa.euskadi.eus/es/patrimonio-cultural/iglesia-de-andra-mari/webtur00-content/es/,0.0,0.0,0.0,Patrimonio Cultural,"43.2363892,-2.8328195999999934",43.2363892,-2.832819599999993
Necrópolis de Argiñeta,"La necrópolis de Argiñeta, tanto por el número y calidad de sus element...",Patrimonio cultural,Barrio Zenita,Elorrio,Bizkaia,48230.0,Montes y Valles vascos,turismoa@elorrio.eus,946 820 164,,https://turismoa.euskadi.eus/es/patrimonio-cultural/necropolis-de-argineta/webtur00-content/es/,1.0,0.0,0.0,Patrimonio Cultural,"43.13989363781302,-2.5360636597412256",43.13989363781302,-2.5360636597412256
Cuevas de Santimamiñe,Las cuevas de Santimamiñe están situadas en un paraje incomparable: la orilla derec...,Patrimonio cultural,Barrio Basondo,Kortezubi,Bizkaia,48315.0,Montes y Valles vascos,santimamine@bizkaia.eus,944 651 657,,https://turismoa.euskadi.eus/es/patrimonio-cultural/cuevas-de-santimamine/webtur00-content/es/,0.0,0.0,0.0,Patrimonio Cultural,"43.34650604,-2.6366073",43.34650604,-2.6366073
Castillo de Butrón,"El castillo de Butrón nos traslada a la Edad Media, a las guerras banderizas entre diferen...",Patrimonio cultural,Butrón s/n,Gatika,Bizkaia,48110.0,Montes y Valles vascos,,,,https://turismoa.euskadi.eus/es/patrimonio-cultural/castillo-de-butron/webtur00-content/es/,0.0,0.0,0.0,Patrimonio Cultural,"43.37150575591259,-2.913674658166552",43.37150575591259,-2.913674658166552
Menhir de Itaida,"Junto a un cruce de la pista que va desde el alto de Opakua hasta Urbasa, se encuentra el menhir ...",Patrimonio cultural,Parzonería de Entzia,Agurain/Salvatierra,Araba/Álava,1200.0,Montes y Valles vascos,2turismo@arabakolautada.eus,945 302 931,https://www.visitlautada.com/,https://turismoa.euskadi.eus/es/patrimonio-cultural/menhir-de-itaida/webtur00-content/es/,0.0,0.0,0.0,Patrimonio Cultural,"42.848183324999304,-2.389012750781262",42.8481833249993,-2.389012750781262
Crómlech de Mendiluze,"El crómlech de Mendiluze fue descubierto en 1983 en las campas de Legaire, en la Sierra de...",Patrimonio cultural,Sierra de Entzia,Agurain/Salvatierra,Araba/Álava,1200.0,Montes y Valles vascos,2turismo@arabakolautada.eus,945 30 29 31,https://www.visitlautada.com/,https://turismoa.euskadi.eus/es/patrimonio-cultural/cromlech-de-mendiluze/webtur00-content/es/,0.0,0.0,0.0,Patrimonio Cultural,"42.83963787797031,-2.286363888549772",42.83963787797031,-2.286363888549772
Dolmen de Sorginetxe,El Dolmen de Sorginetxe es un monumento funerario construido aproximadamente en el añ...,Patrimonio cultural,,Agurain/Salvatierra,Araba/Álava,1200.0,Montes y Valles vascos,2turismo@arabakolautada.eus,945 302 931,,https://turismoa.euskadi.eus/es/patrimonio-cultural/dolmen-de-sorginetxe/webtur00-content/es/,0.0,0.0,0.0,Patrimonio Cultural,"42.8279007,-2.372036699999967",42.8279007,-2.372036699999967
Cuevas de Altxerri,Las cuevas de Altxerri se encuentran dentro del complejo de cuevas prehistóricas...,Patrimonio cultural,Barrio Ubegun,Aia,Gipuzkoa,20809.0,Montes y Valles vascos,iturraran@gipuzkoanatura.eus,943 835 389,,https://turismoa.euskadi.eus/es/patrimonio-cultural/cuevas-de-altxerri/webtur00-content/es/,0.0,0.0,0.0,Patrimonio Cultural,"43.2695630796511,-2.1343071057128715",43.2695630796511,-2.1343071057128715
Ekainberri,"Pueden ser contemplados en la réplica que se ha hecho de la cueva de Ekain, denominada Eka...",Patrimonio cultural,"Portale kalea, 1",Zestoa,Gipuzkoa,20740.0,Montes y Valles vascos,info@ekainberri.com,943 868 811,https://www.ekainberri.eus/,https://turismoa.euskadi.eus/es/patrimonio-cultural/ekainberri/webtur00-content/es/,1.0,0.0,0.0,Patrimonio Cultural,"43.23679162600305,-2.2673777868469642",43.23679162600305,-2.267377786846964
Dolmen de la Chabola de la Hechicera,Fue descubierto en 1935. La cámara está formada por 9 losas que describen una figur...,Patrimonio cultural,Carretera Laguardia-Elvillar A-3228,Elvillar/Bilar,Araba/Álava,1309.0,Rioja Alavesa,aelvillar@ayto.araba.eus,945 604 011,https://turismo.euskadi.eus/es/patrimonio-cultural/dolmen-de-la-chabola-de-la-hechicera/webtur00-content/es/,https://turismoa.euskadi.eus/es/patrimonio-cultural/dolmen-de-la-chabola-de-la-hechicera/webtur00-content/es/,0.0,0.0,0.0,Patrimonio Cultural,"42.57432103728761,-2.569427490234375",42.57432103728761,-2.569427490234375
Torre de Doña Otxanda,La torre de Doña Otxanda es un bello edificio rematado por almenas. Es una de las muchas e...,Patrimonio cultural,"Calle Fundadora de las Siervas de Jesús, 24",Vitoria-Gasteiz,Araba/Álava,1001.0,Vitoria-Gasteiz,mcna@alava.net,945 181 924,,https://turismoa.euskadi.eus/es/patrimonio-cultural/torre-de-dona-otxanda/webtur00-content/es/,1.0,0.0,0.0,Patrimonio Cultural,"42.8503186,-2.674561400000016",42.8503186,-2.674561400000016
Torre de Los Anda,"La Torre de los Anda, erigida en el siglo XV, es una de las construcciones más antiguas de...",Patrimonio cultural,"Calle Correría, 110; Plaza de la Burullería",Vitoria-Gasteiz,Araba/Álava,1001.0,Vitoria-Gasteiz,turismo@vitoria-gasteiz.org,945 161 598,,https://turismoa.euskadi.eus/es/patrimonio-cultural/torre-de-los-anda/webtur00-content/es/,0.0,0.0,0.0,Patrimonio Cultural,"42.8500365,-2.6737552",42.8500365,-2.6737552
Santuario de Arantzazu,"Según la leyenda, a un pastor llamado Rodrigo de Balzategi se le apareció la Virgen...",Patrimonio cultural,Barrio de Arantzazu,Oñati,Gipuzkoa,20567.0,Montes y Valles vascos,asisgunea@arantzazu.org,943 780 951,,https://turismoa.euskadi.eus/es/patrimonio-cultural/santuario-de-arantzazu/webtur00-content/es/,1.0,0.0,1.0,Patrimonio Cultural,"42.97927848459495,-2.39867051586907",42.97927848459495,-2.39867051586907
Palacio Bendaña,El Palacio Bendaña está situado en pleno corazón de la Vitoria medieval. Se ...,Patrimonio cultural,"Cuchillería, 54",Vitoria-Gasteiz,Araba/Álava,1001.0,Vitoria-Gasteiz,bibat@alava.net,945 203 707,,https://turismoa.euskadi.eus/es/patrimonio-cultural/palacio-bendana/webtur00-content/es/,1.0,0.0,1.0,Patrimonio Cultural,"42.8498801,-2.671414899999945",42.8498801,-2.671414899999945
Palacio de Montehermoso,El Palacio de Montehermoso es una de las primeras construcciones señoriales que se levanta...,Patrimonio cultural,"Calle Fray Zacarías Martínez, 2",Vitoria-Gasteiz,Araba/Álava,1001.0,Vitoria-Gasteiz,info.montehermoso@vitoria-gasteiz.org,945 161 830,http://www.montehermoso.net/,https://turismoa.euskadi.eus/es/patrimonio-cultural/palacio-de-montehermoso/webtur00-content/es/,1.0,0.0,0.0,Patrimonio Cultural,"42.8486002,-2.6728365000000167",42.8486002,-2.6728365000000167
Torre de Mendoza,La torre de los Mendoza es un claro ejemplo de torre-vivienda fortificada. Fue durante más...,Patrimonio cultural,"Mendoza, s/n",Vitoria-Gasteiz,Araba/Álava,1191.0,Vitoria-Gasteiz,,945 16 15 98,,https://turismoa.euskadi.eus/es/patrimonio-cultural/torre-de-mendoza/webtur00-content/es/,0.0,0.0,1.0,Patrimonio Cultural,"42.85980141,-2.77405623",42.85980141,-2.77405623
Torre-Palacio de los Varona,La Torre-Palacio de los Varona es ejemplo de solidez y fuerza. No solo por la característi...,Patrimonio cultural,"Calle Real, 11",Valdegovía/Gaubea,Araba/Álava,1426.0,Montes y Valles vascos,turismo@valdegovia.com,945 35 30 35,http://www.ananaturismo.com/lugares/torre-palacio-varona/,https://turismoa.euskadi.eus/es/patrimonio-cultural/torre-palacio-de-los-varona/webtur00-content/es/,1.0,0.0,1.0,Patrimonio Cultural,"42.8297884559684,-3.0714923269836163",42.8297884559684,-3.0714923269836163
Palacio de los Ayala,Fue residencia del linaje que da nombre a todo el valle: los Ayala. Se construyó en el sig...,Patrimonio cultural,Quejana,Ayala/Aiara,Araba/Álava,1477.0,Montes y Valles vascos,turismo.ayala@gmail.com,945 399 414,,https://turismoa.euskadi.eus/es/patrimonio-cultural/palacio-de-los-ayala/webtur00-content/es/,1.0,0.0,0.0,Patrimonio Cultural,"43.0814971,-3.063037500000064",43.0814971,-3.063037500000064
Palacio de Ajuria Enea,"Situado en una de las zonas residenciales más destacadas de Vitoria, el bello Palacio de ...",Patrimonio cultural,"Paseo Fray Francisco de Vitoria, 5",Vitoria-Gasteiz,Araba/Álava,1007.0,Vitoria-Gasteiz,,,,https://turismoa.euskadi.eus/es/patrimonio-cultural/palacio-de-ajuria-enea/webtur00-content/es/,0.0,0.0,0.0,Patrimonio Cultural,"42.8395686,-2.6837529",42.8395686,-2.6837529
Fuerte de Guadalupe,El fuerte de Guadalupe es una de las construcciones defensivas más bellas de Hondarribia.E...,Patrimonio cultural,"Carretera Jaizkibel GI-3440, barrio Gornutz Montaña",Hondarribia,Gipuzkoa,20280.0,Costa Vasca,info@armaplaza.eus,943 643 677,,https://turismoa.euskadi.eus/es/patrimonio-cultural/fuerte-de-guadalupe/webtur00-content/es/,1.0,0.0,0.0,Patrimonio Cultural,"43.37004606341497,-1.8176744549560575",43.37004606341497,-1.8176744549560573
Catedral del Buen Pastor,La Catedral del Buen Pastor es la construcción religiosa más grande de San Sebasti&...,Patrimonio cultural,"Plaza del Buen Pastor, s/n",Donostia / San Sebastián,Gipuzkoa,20005.0,"Costa Vasca,San Sebastián",,943 464 516,,https://turismoa.euskadi.eus/es/patrimonio-cultural/catedral-del-buen-pastor/webtur00-content/es/,1.0,0.0,0.0,Patrimonio Cultural,"43.3167285180224,-1.981534229360932",43.3167285180224,-1.981534229360932
Basílica de Santa María del Coro,"Situada junto a la ladera sur del monte Urgull, en el corazón de la Parte Vieja, la Bas&ia...",Patrimonio cultural,"C/ 31 de Agosto, 46",Donostia / San Sebastián,Gipuzkoa,20003.0,"Costa Vasca,San Sebastián",,943 481 166,,https://turismoa.euskadi.eus/es/patrimonio-cultural/basilica-de-santa-maria-del-coro/webtur00-content/es/,1.0,0.0,0.0,Patrimonio Cultural,"43.3241017,-1.9857227999999623",43.3241017,-1.9857227999999625
Santuario de Guadalupe,"El elegante Santuario de la Virgen de Guadalupe, patrona de Hondarribia, es visible desde pr&aacu...",Patrimonio cultural,"Carretera Jaizkibel, GI-3440, barrio Gornutz Montaña",Hondarribia,Gipuzkoa,20280.0,Costa Vasca,,943 640 764,,https://turismoa.euskadi.eus/es/patrimonio-cultural/santuario-de-guadalupe/webtur00-content/es/,0.0,0.0,1.0,Patrimonio Cultural,"43.36727158030797,-1.8210013306884387",43.36727158030797,-1.8210013306884387
Catedral de Santa María,La Catedral de Santa María se levanta majestuosa en el casco antiguo de Vitoria-Gasteiz. L...,Patrimonio cultural,"Plaza Santa María, 3",Vitoria-Gasteiz,Araba/Álava,1001.0,Vitoria-Gasteiz,visitas@catedralvitoria.eus,945 255 135,https://www.catedralvitoria.eus/,https://turismoa.euskadi.eus/es/patrimonio-cultural/catedral-de-santa-maria/webtur00-content/es/,1.0,0.0,0.0,Patrimonio Cultural,"42.850641019644655,-2.6725128441803463",42.850641019644655,-2.6725128441803463
Catedral de María Inmaculada (Catedral Nueva),La Catedral de María Inmaculada o Catedral Nueva es el edificio neogótico má...,Patrimonio cultural,"Calle Magdalena, 1",Vitoria-Gasteiz,Araba/Álava,1008.0,Vitoria-Gasteiz,info@kalearte.com,945 101 070,,https://turismoa.euskadi.eus/es/patrimonio-cultural/catedral-de-maria-inmaculada-catedral-nueva/webtur00-content/es/,0.0,0.0,0.0,Patrimonio Cultural,"42.84557896990384,-2.6763429507873298",42.84557896990384,-2.6763429507873298
Santuario de Nuestra Señora de Estibaliz,"A escasos 10 kilómetros de Vitoria-Gasteiz, en lo alto de una colina convertida en parque ...",Patrimonio cultural,"Villafranca, 2",Vitoria-Gasteiz,Araba/Álava,1193.0,Vitoria-Gasteiz,,,,https://turismoa.euskadi.eus/es/patrimonio-cultural/santuario-de-nuestra-senora-de-estibaliz/webtur00-content/es/,1.0,0.0,1.0,Patrimonio Cultural,"42.849050951102775,-2.5683596248535423",42.849050951102775,-2.5683596248535423
Basílica de San Prudencio,La basílica de San Prudencio en Vitoria-Gasteiz es una de las construcciones rom...,Patrimonio cultural,"Alto de Armentia, 24",Vitoria-Gasteiz,Araba/Álava,1195.0,Vitoria-Gasteiz,,945 133 905,,https://turismoa.euskadi.eus/es/patrimonio-cultural/basilica-de-san-prudencio/webtur00-content/es/,0.0,0.0,0.0,Patrimonio Cultural,"42.8363483,-2.7016764",42.8363483,-2.7016764
Iglesia de Santa María de los Reyes,"La iglesia de Santa María de los Reyes, situada en la zona norte de Laguardia, comenz&oacu...",Patrimonio cultural,Calle Mayor,Laguardia,Araba/Álava,1300.0,Rioja Alavesa,,945 600 007,,https://turismoa.euskadi.eus/es/patrimonio-cultural/iglesia-de-santa-maria-de-los-reyes/webtur00-content/es/,1.0,0.0,0.0,Patrimonio Cultural,"42.55506709427038,-2.585530139950606",42.55506709427038,-2.585530139950606
Parroquia de Santa María la Real (Zarautz),La parroquia de Santa María la Real fue construida en estilo gótico a finales del s...,Patrimonio cultural,"Elizaurre, 1",Zarautz,Gipuzkoa,20800.0,Costa Vasca,info@menosca.com,943 835 281,,https://turismoa.euskadi.eus/es/patrimonio-cultural/parroquia-de-santa-maria-la-real-zarautz/webtur00-content/es/,1.0,0.0,0.0,Patrimonio Cultural,"43.28646519402452,-2.1775636245022234",43.28646519402452,-2.1775636245022234
Iglesia de San Salvador,"La Iglesia de San Salvador es una joya del arte gótico y, aunque la construcción de...",Patrimonio cultural,"Kale Nagusia, 39",Getaria,Gipuzkoa,20808.0,Costa Vasca,,943 140 751,,https://turismoa.euskadi.eus/es/patrimonio-cultural/iglesia-de-san-salvador/webtur00-content/es/,1.0,0.0,0.0,Patrimonio Cultural,"43.304486084845095,-2.203569001852439",43.304486084845095,-2.203569001852439
Serantes Kultur Aretoa,El Serantes Kultur Aretoa ofrece una programación cultural variada y de calidad. Con insta...,Teatros y Cines,"Plaza Gabriel Aresti, s/n",Santurtzi,Bizkaia,48980.0,"Costa Vasca,Bilbao",serantes@serantes.com,944 839 244,http://www.serantes.com/,https://turismoa.euskadi.eus/es/teatros-cines/serantes-kultur-aretoa/webtur00-content/es/,0.0,984.0,0.0,Patrimonio Cultural,"43.32655237127071,-3.0329493588608236",43.32655237127071,-3.032949358860824
Santuario de Loiola,El colosal edificio del Santuario de Loiola de Azpeitia se construyó en el siglo XVII...,Patrimonio cultural,"Carretera GI-631, entre Azkoitia y Azpeitia",Azpeitia,Gipuzkoa,20730.0,"Montes y Valles vascos,San Sebastián",loiolasant@euskalnet.net,943 025 000,http://www.santuariodeloyola.org/,https://turismoa.euskadi.eus/es/top10/patrimonio-cultural/santuario-de-loiola/webtur00-content/es/,0.0,0.0,1.0,Patrimonio Cultural,"43.17420772620036,-2.282586292065389",43.17420772620036,-2.282586292065389
Teatro Social Antzokia,El Teatro Social Antzokia de Basauri se ha convertido en centro cultural de referencia tanto de E...,Teatros y Cines,"Kale Nagusia, 2",Basauri,Bizkaia,48970.0,Bilbao,oiac@basauri.net,944 666 390,http://socialantzokia.eus/,https://turismoa.euskadi.eus/es/teatros-cines/teatro-social-antzokia/webtur00-content/es/,0.0,756.0,0.0,Patrimonio Cultural,"43.23522790000001,-2.8891945000000305",43.23522790000001,-2.8891945000000305
Parroquia de Santa María la Real (Azkoitia),"La Parroquia de Santa María la Real, de estilo renacentista vasco, data del siglo XVI. Tie...",Patrimonio cultural,"Calle de Nagusia, 61",Azkoitia,Gipuzkoa,20720.0,Montes y Valles vascos,i-loiola@urolaturismoa.eus,943 852 157,,https://turismoa.euskadi.eus/es/patrimonio-cultural/parroquia-de-santa-maria-la-real-azkoitia/webtur00-content/es/,1.0,0.0,0.0,Patrimonio Cultural,"43.178332511881045,-2.3116195232787495",43.178332511881045,-2.311619523278749
Santuario de Nuestra Señora de Itziar,El Santuario de Santa María de Itziar es un templo antiquísimo. Las primeras notici...,Patrimonio cultural,"Plaza principal, Itziar",Deba,Gipuzkoa,20829.0,Costa Vasca,,943 199 304,,https://turismoa.euskadi.eus/es/patrimonio-cultural/santuario-de-nuestra-senora-de-itziar/webtur00-content/es/,0.0,0.0,0.0,Patrimonio Cultural,"43.27645788456144,-2.3316569374344542",43.27645788456144,-2.3316569374344542
Torre Luzea,"Torre Luzea es un magnífico edificio del siglo XV, en perfecto estado de conservaci&oacute...",Patrimonio cultural,"Nagusia, 28",Zarautz,Gipuzkoa,20800.0,Costa Vasca,arazi@arazi.eus,943 833 641,,https://turismoa.euskadi.eus/es/patrimonio-cultural/torre-luzea/webtur00-content/es/,0.0,0.0,0.0,Patrimonio Cultural,"43.28590015485314,-2.1750275534918684",43.28590015485314,-2.1750275534918684
El Portalón,Esta preciosa torre-edificio gótica fue construida como posada de mercaderes. Ubicada en l...,Patrimonio cultural,"Correría, 147-149",Vitoria-Gasteiz,Araba/Álava,1001.0,Vitoria-Gasteiz,,945 14 27 55,,https://turismoa.euskadi.eus/es/patrimonio-cultural/el-portalon/webtur00-content/es/,0.0,0.0,0.0,Patrimonio Cultural,"42.8514016,-2.6730645000000095",42.8514016,-2.673064500000009
